<!ELEMENT editor (parrafo)+>
<!ELEMENT parrafo (#PCDATA | cursiva | negrita)*>
<!ELEMENT cursiva (#PCDATA | negrita)*>
<!ELEMENT negrita (#PCDATA | cursiva)*>


